{
  "schemaVersion": 1,
  "show": "kukhnya",
  "season": 5,
  "episode": 12,
  "title": "The Proposal",
  "scenes": [
    {
      "scene": 1,
      "start": "00:00:22,190",
      "end": "00:01:02,320",
      "title": "A Late-Night Call and Stewed Meat",
      "summary": "Max wakes up to a late-night phone call from pregnant Vika asking him to bring her canned stewed meat.",
      "characters": [
        "Max",
        "Vika"
      ],
      "location": "Квартира Макса и Вики",
      "merge": null
    },
    {
      "scene": 2,
      "start": "00:01:02,320",
      "end": "00:02:15,690",
      "title": "A Night Visit to Vika's",
      "summary": "Max brings Vika her midnight craving and is invited to stay the night until Vika's sister Tanya reminds them of their upcoming divorce.",
      "characters": [
        "Vika",
        "Max",
        "Tanya"
      ],
      "location": "Квартира Макса и Вики",
      "merge": null
    },
    {
      "scene": 3,
      "start": "00:02:15,690",
      "end": "00:02:52,650",
      "title": "The Forgotten Birthday",
      "summary": "Elena hints about evening plans in the car, and Chef Barinov reveals he completely forgot that today is her birthday.",
      "characters": [
        "Chef",
        "Elena"
      ],
      "location": "Внутренний двор",
      "merge": null
    },
    {
      "scene": 4,
      "start": "00:02:52,650",
      "end": "00:03:30,020",
      "title": "The Promised Surprise",
      "summary": "Viktor covers up his memory lapse by claiming he planned a secret evening birthday surprise for Elena.",
      "characters": [
        "Chef",
        "Elena"
      ],
      "location": "Внутренний двор",
      "merge": null
    },
    {
      "scene": 5,
      "start": "00:03:30,020",
      "end": "00:04:30,860",
      "title": "Collision of the Ex and the Future",
      "summary": "Elena and Eleonora collide in the hallway and in the parking lot, and Eleonora mocks Viktor when she hears today is Elena's birthday.",
      "characters": [
        "Eleonora",
        "Elena",
        "Chef"
      ],
      "location": "Холл отеля «Элеон»",
      "merge": null
    },
    {
      "scene": 6,
      "start": "00:04:30,860",
      "end": "00:05:50,060",
      "title": "The Jewelry Store and Rumors",
      "summary": "Vika admits her pregnancy cravings to her sister, while Chef Barinov asks for the nearest jewelry store, sparking proposal rumors.",
      "characters": [
        "Vika",
        "Chef",
        "Senya"
      ],
      "location": "Кухня «Victor»",
      "merge": null
    },
    {
      "scene": 7,
      "start": "00:05:50,060",
      "end": "00:07:26,230",
      "title": "Pregnancy Massage",
      "summary": "Tanya gives Vika the card of a pregnancy masseur and tells Max that Vika's hormones are making her crave intimacy.",
      "characters": [
        "Vika",
        "Tanya",
        "Mikhail"
      ],
      "location": "Холл отеля «Элеон»",
      "merge": null
    },
    {
      "scene": 8,
      "start": "00:07:26,230",
      "end": "00:08:14,360",
      "title": "Betting on the Little Box",
      "summary": "Senya spots a velvet jewelry box in Chef Barinov's office and bets the cooks that it holds an engagement ring.",
      "characters": [
        "Chef",
        "Senya",
        "Fedya"
      ],
      "location": "Кабинет Шефа",
      "merge": null
    },
    {
      "scene": 9,
      "start": "00:08:14,360",
      "end": "00:10:09,260",
      "title": "Advice on a Surprise",
      "summary": "Max asks Kostya about pregnancy hormones, then advises Chef Barinov to sing a song for Elena's birthday surprise.",
      "characters": [
        "Max",
        "Kostya",
        "Chef"
      ],
      "location": "Кабинет Шефа",
      "merge": null
    },
    {
      "scene": 10,
      "start": "00:10:09,260",
      "end": "00:11:55,800",
      "title": "A Song in the Laundry Room and the Lost Pendant",
      "summary": "While Chef Barinov rehearses a song and tango in the laundry room, Senya and Fedya accidentally lose his pendant.",
      "characters": [
        "Chef",
        "Senya",
        "Max"
      ],
      "location": "Холодильная камера и склад",
      "merge": null
    },
    {
      "scene": 11,
      "start": "00:11:55,800",
      "end": "00:12:42,800",
      "title": "Only Tomorrow's Divorce",
      "summary": "Max tries to seduce Vika based on her sister's hormone comment, and Vika angrily tells him she only wants tomorrow's divorce.",
      "characters": [
        "Max",
        "Vika"
      ],
      "location": "Раздевалка и коридор",
      "merge": null
    },
    {
      "scene": 12,
      "start": "00:12:42,800",
      "end": "00:13:53,340",
      "title": "The Garbage Truck and the Masseur",
      "summary": "Senya and Fedya learn the chef's gift was hauled away in the trash, while Vika meets her pregnancy massage therapist.",
      "characters": [
        "Senya",
        "Gulya",
        "Vika"
      ],
      "location": "Зал ресторана «Victor»",
      "merge": null
    },
    {
      "scene": 13,
      "start": "00:13:53,340",
      "end": "00:15:13,040",
      "title": "The Engagement Ring and the Suspicious Card",
      "summary": "Senya and Fedya buy an engagement ring to replace the chef's lost pendant, while Max and Kostya suspect Vika's masseur.",
      "characters": [
        "Senya",
        "Kostya",
        "Max"
      ],
      "location": "Барная стойка",
      "merge": null
    },
    {
      "scene": 14,
      "start": "00:15:13,040",
      "end": "00:16:20,910",
      "title": "The Phone Test",
      "summary": "Nastya calls the masseur to test him, and his flirtatious reply sends Max racing upstairs with a spare room key.",
      "characters": [
        "Kostya",
        "Max",
        "Nastya"
      ],
      "location": "Барная стойка",
      "merge": null
    },
    {
      "scene": 15,
      "start": "00:16:20,910",
      "end": "00:17:18,940",
      "title": "The Ventilation and Premature Congratulations",
      "summary": "Chef Barinov agrees to inspect the kitchen ventilation shaft while the staff prematurely congratulate Elena on getting engaged.",
      "characters": [
        "Chef",
        "Lyova",
        "Elena"
      ],
      "location": "Кухня «Victor»",
      "merge": null
    },
    {
      "scene": 16,
      "start": "00:17:18,940",
      "end": "00:18:28,400",
      "title": "The Toast and the Velvet Box",
      "summary": "Lyova escorts Elena to the table, where Chef Barinov gives a heartfelt birthday speech and presents the jewelry box.",
      "characters": [
        "Elena",
        "Lyova",
        "Chef"
      ],
      "location": "Зал ресторана «Victor»",
      "merge": null
    },
    {
      "scene": 17,
      "start": "00:18:28,400",
      "end": "00:19:49,140",
      "title": "I Do",
      "summary": "Elena sees the ring in the box and says 'I do,' but Viktor blurts out that he bought a pendant, humiliating her.",
      "characters": [
        "Chef",
        "Elena",
        "Vika"
      ],
      "location": "Зал ресторана «Victor»",
      "merge": null
    },
    {
      "scene": 18,
      "start": "00:19:49,140",
      "end": "00:20:40,680",
      "title": "Who Swapped the Pendant",
      "summary": "After Max embarrasses himself in Vika's room, Chef Barinov confronts Senya and Fedya for swapping his pendant for a ring.",
      "characters": [
        "Max",
        "Senya",
        "Chef"
      ],
      "location": "Кухня «Victor»",
      "merge": null
    },
    {
      "scene": 19,
      "start": "00:20:40,680",
      "end": "00:21:53,760",
      "title": "Talking Through the Ventilation Shaft",
      "summary": "Stuck in the ventilation shaft, Chef Barinov inspires Max to tell Vika through the air duct that he will always be there for her and their daughter.",
      "characters": [
        "Max",
        "Vika",
        "Chef"
      ],
      "location": "Раздевалка и коридор",
      "merge": null
    },
    {
      "scene": 20,
      "start": "00:21:53,760",
      "end": "00:23:53,060",
      "title": "Marry Me",
      "summary": "Chef Barinov proposes to Elena from a horse-drawn carriage, Max and Vika finalize their divorce with hope left, and Kostya surprises Nastya.",
      "characters": [
        "Max",
        "Chef",
        "Kostya"
      ],
      "location": "Внутренний двор",
      "merge": null
    }
  ]
}
